{
  "id": "UsefulRunestones",
  "package": "sighsorry-UsefulRunestones",
  "version": "1.0.3",
  "assembly": "UsefulRunestones",
  "guids": [
    "sighsorry.UsefulRunestones"
  ],
  "words": {},
  "englishWords": {},
  "texts": {
    "Haldor": "Хальдор",
    "You got bamboozled": "Вас провели",
    "You already have this effect": "Этот эффект уже действует",
    "Hildir_camp": "Лагерь Хильдир",
    "BogWitch_Camp": "Хижина Болотной ведьмы",
    "SunkenCrypt4": "Затонувший склеп",
    "MountainCave02": "Горная пещера",
    "StoneHenge1": "Стоунхендж",
    "StoneHenge3": "Путевые камни",
    "StoneHenge4": "Погребальные камни",
    "StoneHenge5": "Каменный путевой знак",
    "Mistlands_DvergrTownEntrance1": "Разрушенные шахты двергов",
    "Mistlands_DvergrTownEntrance2": "Заражённые шахты",
    "Mistlands_Excavation1": "Место раскопок",
    "Mistlands_Excavation2": "Место раскопок",
    "Mistlands_Excavation3": "Место раскопок",
    "PlaceofMystery1": "Таинственные руины",
    "PlaceofMystery2": "Таинственные руины",
    "PlaceofMystery3": "Таинственные руины",
    "CombatRuin01": "Руины поля боя"
  },
  "patterns": [
    {
      "source": "You have received {0}",
      "target": "Получен эффект: {0}"
    },
    {
      "source": "Buff Cooldown {0}s",
      "target": "До следующего усиления: {0} с"
    },
    {
      "source": "Already active {0}",
      "target": "Уже действует: {0}"
    }
  ],
  "returns": [],
  "prefabs": [],
  "sourceFiles": [
    "source-evidence/localization/d/sighsorry-UsefulRunestones-proj/UsefulRunestones/UsefulRunestonesPlugin.cs"
  ],
  "notes": [
    "version — версия пакета Gale; pluginVersion и assembly — метаданные приложенной декомпиляции. Игровой запуск не выполнен."
  ],
  "namespaces": [
    "UsefulRunestones"
  ],
  "pluginVersion": "1.0.3",
  "mapLabels": {
    "Haldor": "Хальдор",
    "Hildir_camp": "Лагерь Хильдир",
    "BogWitch_Camp": "Хижина Болотной ведьмы",
    "SunkenCrypt4": "Затонувший склеп",
    "MountainCave02": "Горная пещера",
    "StoneHenge1": "Стоунхендж",
    "StoneHenge3": "Путевые камни",
    "StoneHenge4": "Погребальные камни",
    "StoneHenge5": "Каменный путевой знак",
    "Mistlands_DvergrTownEntrance1": "Разрушенные шахты двергов",
    "Mistlands_DvergrTownEntrance2": "Заражённые шахты",
    "Mistlands_Excavation1": "Место раскопок",
    "Mistlands_Excavation2": "Место раскопок",
    "Mistlands_Excavation3": "Место раскопок",
    "PlaceofMystery1": "Таинственные руины",
    "PlaceofMystery2": "Таинственные руины",
    "PlaceofMystery3": "Таинственные руины",
    "CombatRuin01": "Руины поля боя"
  }
}
