{
  "id": "BuildCamera",
  "package": "Azumatt-Build_Camera_Custom_Hammers_Edition",
  "version": "1.3.4",
  "assembly": "Build Camera",
  "guids": [
    "Azumatt.BuildCameraCHE"
  ],
  "words": {
    "buildcamera_needs_cozy": "Для строительной камеры нужен уют (комфорт: $1).",
    "buildcamera_pickup_blocked_title": "Подбор строительной камерой",
    "buildcamera_pickup_blocked": "Повысьте комфорт, чтобы подбирать предметы строительной камерой.\nТребуемый комфорт: $1"
  },
  "englishWords": {
    "buildcamera_needs_cozy": "Be cozy to use Build Camera (requires comfort $1).",
    "buildcamera_pickup_blocked_title": "Build Camera Pickup",
    "buildcamera_pickup_blocked": "Get cozy before collecting items through the build camera.\nRequired comfort: $1"
  },
  "texts": {},
  "patterns": [],
  "returns": [],
  "prefabs": [],
  "sourceFiles": [
    "source-evidence/profile-updates/Azumatt-Build_Camera_Custom_Hammers_Edition-1.3.4/ServerSync/VersionCheck.cs",
    "source-evidence/profile-updates/Azumatt-Build_Camera_Custom_Hammers_Edition-1.3.4/Valheim_Build_Camera/Utils.cs",
    "source-evidence/profile-updates/Azumatt-Build_Camera_Custom_Hammers_Edition-1.3.4/Valheim_Build_Camera/Valheim_Build_CameraPlugin.cs",
    "source-evidence/profile-updates/Azumatt-Build_Camera_Custom_Hammers_Edition-1.3.4/il/Build Camera.il"
  ],
  "notes": [
    "version — версия пакета Gale; pluginVersion и assembly — метаданные приложенной декомпиляции. Игровой запуск не выполнен.",
    "Пакет текущего профиля проверен 2026-10-07 по точной установленной DLL и декомпиляции; версия пакета и BepInPlugin сверены отдельно. Игровая приёмка относится к общей квитанции выпуска."
  ],
  "namespaces": [
    "Valheim_Build_Camera",
    "ServerSync"
  ],
  "pluginVersion": "1.3.4",
  "literals": [
    {
      "type": "Valheim_Build_Camera.Utils",
      "method": "EnableBuildMode",
      "values": {
        "Entering Build Mode.": "Переход в режим строительства."
      }
    },
    {
      "type": "ServerSync.VersionCheck",
      "method": "ErrorServer",
      "values": {
        "Disconnect: The client (": "Отключение: у клиента (",
        ") doesn't have the correct ": ") неподходящая версия ",
        " version ": " — нужна версия "
      }
    },
    {
      "type": "ServerSync.VersionCheck",
      "method": "ErrorClient",
      "values": {
        " is not installed on the server.": " не установлен на сервере.",
        " needs to be at least version ": " — нужна версия не ниже ",
        ". You have version ": ". У вас версия ",
        " may not be higher than version ": " — версия должна быть не выше "
      }
    },
    {
      "type": "ServerSync.VersionCheck",
      "method": "ShowConnectionError",
      "values": {
        "\nServer expects you to have ": "\nСервер требует установить ",
        " (Version: ": " (версия: ",
        ") installed.": ")."
      }
    }
  ]
}
