{
  "id": "AzuWorkbenchTweaks",
  "package": "Azumatt-AzuWorkbenchTweaks",
  "version": "1.0.7",
  "pluginVersion": "1.0.7",
  "assembly": "AzuWorkbenchTweaks",
  "guids": [
    "Azumatt.AzuWorkbenchTweaks"
  ],
  "namespaces": [
    "AzuWorkbenchTweaks",
    "ServerSync"
  ],
  "words": {},
  "englishWords": {},
  "texts": {},
  "patterns": [],
  "returns": [],
  "literals": [
    {
      "type": "ServerSync.VersionCheck",
      "method": "ErrorServer",
      "values": {
        "Disconnect: The client (": "Отключение: у клиента (",
        ") doesn't have the correct ": ") неподходящая версия ",
        " version ": " — нужна версия "
      }
    },
    {
      "type": "ServerSync.VersionCheck",
      "method": "ErrorClient",
      "values": {
        " is not installed on the server.": " не установлен на сервере.",
        " needs to be at least version ": " — нужна версия не ниже ",
        ". You have version ": ". У вас версия ",
        " may not be higher than version ": " — версия должна быть не выше "
      }
    },
    {
      "type": "ServerSync.VersionCheck",
      "method": "ShowConnectionError",
      "values": {
        "\nServer expects you to have ": "\nСервер требует установить ",
        " (Version: ": " (версия: ",
        ") installed.": ")."
      }
    },
    {
      "type": "AzuWorkbenchTweaks.RpcHandlers",
      "method": "RPC_AzuWorkbenchTweaks_Version",
      "values": {
        "AzuWorkbenchTweaks Installed: 1.0.7\n Needed: ": "AzuWorkbenchTweaks: установлена версия 1.0.7\n Требуется: "
      }
    }
  ],
  "prefabs": [],
  "sourceFiles": [
    "source-evidence/stage-b/Azumatt-AzuWorkbenchTweaks-1.0.7/AzuWorkbenchTweaks/AzuWorkbenchTweaksPlugin.cs",
    "source-evidence/stage-b/Azumatt-AzuWorkbenchTweaks-1.0.7/AzuWorkbenchTweaks.csproj",
    "source-evidence/stage-b/Azumatt-AzuWorkbenchTweaks-1.0.7/ServerSync/VersionCheck.cs",
    "source-evidence/stage-b/Azumatt-AzuWorkbenchTweaks-1.0.7/AzuWorkbenchTweaks/RpcHandlers.cs",
    "source-evidence/stage-b/Azumatt-AzuWorkbenchTweaks-1.0.7/AzuWorkbenchTweaks.ldstr.il"
  ],
  "notes": [
    "Stage B: Azumatt-AzuWorkbenchTweaks 1.0.7 from Thunderstore (deprecated)"
  ]
}
